{
  "schema_version": 1,
  "setups": [],
  "shards": 4,
  "timing_basis": "exclusive-additive-once-per-shard-v1",
  "units": [
    {
      "exclusive_cost_ms": 20,
      "id": "u0000",
      "selectors": [
        "tests/test_generated.py::test_u0000_m0000"
      ],
      "setup_ids": []
    },
    {
      "exclusive_cost_ms": 66,
      "id": "u0001",
      "selectors": [
        "tests/test_generated.py::test_u0001_m0000",
        "tests/test_generated.py::test_u0001_m0001"
      ],
      "setup_ids": []
    },
    {
      "exclusive_cost_ms": 52,
      "id": "u0002",
      "selectors": [
        "tests/test_generated.py::test_u0002_m0000",
        "tests/test_generated.py::test_u0002_m0001"
      ],
      "setup_ids": []
    },
    {
      "exclusive_cost_ms": 34,
      "id": "u0003",
      "selectors": [
        "tests/test_generated.py::test_u0003_m0000",
        "tests/test_generated.py::test_u0003_m0001",
        "tests/test_generated.py::test_u0003_m0002"
      ],
      "setup_ids": []
    },
    {
      "exclusive_cost_ms": 0,
      "id": "u0004",
      "selectors": [
        "tests/test_generated.py::test_u0004_m0000",
        "tests/test_generated.py::test_u0004_m0001"
      ],
      "setup_ids": []
    },
    {
      "exclusive_cost_ms": 98,
      "id": "u0005",
      "selectors": [
        "tests/test_generated.py::test_u0005_m0000",
        "tests/test_generated.py::test_u0005_m0001"
      ],
      "setup_ids": []
    },
    {
      "exclusive_cost_ms": 68,
      "id": "u0006",
      "selectors": [
        "tests/test_generated.py::test_u0006_m0000",
        "tests/test_generated.py::test_u0006_m0001",
        "tests/test_generated.py::test_u0006_m0002"
      ],
      "setup_ids": []
    },
    {
      "exclusive_cost_ms": 82,
      "id": "u0007",
      "selectors": [
        "tests/test_generated.py::test_u0007_m0000",
        "tests/test_generated.py::test_u0007_m0001"
      ],
      "setup_ids": []
    },
    {
      "exclusive_cost_ms": 80,
      "id": "u0008",
      "selectors": [
        "tests/test_generated.py::test_u0008_m0000"
      ],
      "setup_ids": []
    }
  ]
}
