{
  "schema_version": 1,
  "setups": [
    {
      "cost_ms": 61,
      "id": "s0000"
    },
    {
      "cost_ms": 104,
      "id": "s0001"
    },
    {
      "cost_ms": 143,
      "id": "s0002"
    }
  ],
  "shards": 4,
  "timing_basis": "exclusive-additive-once-per-shard-v1",
  "units": [
    {
      "exclusive_cost_ms": 94,
      "id": "u0000",
      "selectors": [
        "tests/test_generated.py::test_u0000_m0000",
        "tests/test_generated.py::test_u0000_m0001"
      ],
      "setup_ids": [
        "s0001",
        "s0002"
      ]
    },
    {
      "exclusive_cost_ms": 67,
      "id": "u0001",
      "selectors": [
        "tests/test_generated.py::test_u0001_m0000"
      ],
      "setup_ids": [
        "s0000",
        "s0002"
      ]
    },
    {
      "exclusive_cost_ms": 24,
      "id": "u0002",
      "selectors": [
        "tests/test_generated.py::test_u0002_m0000"
      ],
      "setup_ids": [
        "s0000",
        "s0001"
      ]
    },
    {
      "exclusive_cost_ms": 97,
      "id": "u0003",
      "selectors": [
        "tests/test_generated.py::test_u0003_m0000"
      ],
      "setup_ids": [
        "s0000",
        "s0002"
      ]
    },
    {
      "exclusive_cost_ms": 2,
      "id": "u0004",
      "selectors": [
        "tests/test_generated.py::test_u0004_m0000",
        "tests/test_generated.py::test_u0004_m0001",
        "tests/test_generated.py::test_u0004_m0002"
      ],
      "setup_ids": [
        "s0000",
        "s0001"
      ]
    },
    {
      "exclusive_cost_ms": 95,
      "id": "u0005",
      "selectors": [
        "tests/test_generated.py::test_u0005_m0000",
        "tests/test_generated.py::test_u0005_m0001",
        "tests/test_generated.py::test_u0005_m0002"
      ],
      "setup_ids": [
        "s0000",
        "s0001"
      ]
    }
  ]
}
