{
  "schema_version": 1,
  "setups": [
    {
      "cost_ms": 57,
      "id": "s0000"
    }
  ],
  "shards": 2,
  "timing_basis": "exclusive-additive-once-per-shard-v1",
  "units": [
    {
      "exclusive_cost_ms": 60,
      "id": "u0000",
      "selectors": [
        "tests/test_generated.py::test_u0000_m0000"
      ],
      "setup_ids": [
        "s0000"
      ]
    },
    {
      "exclusive_cost_ms": 6,
      "id": "u0001",
      "selectors": [
        "tests/test_generated.py::test_u0001_m0000"
      ],
      "setup_ids": [
        "s0000"
      ]
    },
    {
      "exclusive_cost_ms": 44,
      "id": "u0002",
      "selectors": [
        "tests/test_generated.py::test_u0002_m0000"
      ],
      "setup_ids": [
        "s0000"
      ]
    },
    {
      "exclusive_cost_ms": 94,
      "id": "u0003",
      "selectors": [
        "tests/test_generated.py::test_u0003_m0000"
      ],
      "setup_ids": [
        "s0000"
      ]
    }
  ]
}
